{
  "schema_version": "1.0",
  "id": "ctdraft:fixture",
  "revision": 1,
  "state": "validated",
  "game_name": "Fixture Game",
  "game_version": "1.0",
  "target_executable_sha256": "sha256:bbbbbbbbbbbbbbbbbbbbbbbbbbbbbbbbbbbbbbbbbbbbbbbbbbbbbbbbbbbbbbbb",
  "module_set_hash": "sha256:cccccccccccccccccccccccccccccccccccccccccccccccccccccccccccccccc",
  "compatibility_hash": "sha256:aaaaaaaaaaaaaaaaaaaaaaaaaaaaaaaaaaaaaaaaaaaaaaaaaaaaaaaaaaaaaaaa",
  "recipe_id": "recipe:health",
  "verification_run_id": "verification:health",
  "evidence_ids": ["evidence:scan"],
  "proof_ids": ["proof:health"],
  "source_hashes": {"evidence:scan": "sha256:eeeeeeeeeeeeeeeeeeeeeeeeeeeeeeeeeeeeeeeeeeeeeeeeeeeeeeeeeeeeeeee"},
  "generator_version": "ct-draft-v1",
  "content_hash": "sha256:dddddddddddddddddddddddddddddddddddddddddddddddddddddddddddddddd",
  "entries": [{
    "ordinal": 0,
    "parent_ordinal": -1,
    "kind": "module_offset",
    "description": "Health & lives",
    "value_type": "dword",
    "address_width_bits": 64,
    "address": "0x1234",
    "module_name": "game.exe",
    "pointer_offsets": [],
    "byte_array_length": 0,
    "candidate_id": "candidate:health",
    "evidence_ids": ["evidence:scan"],
    "verification_outcome": "pass",
    "compatibility_hash": "sha256:aaaaaaaaaaaaaaaaaaaaaaaaaaaaaaaaaaaaaaaaaaaaaaaaaaaaaaaaaaaaaaaa",
    "risk_flags": [],
    "aob_evidence": []
  }],
  "findings": [],
  "failure_modes": [],
  "created_at": "2026-09-21T00:00:00Z",
  "updated_at": "2026-09-21T00:00:00Z"
}
